{
  "$schema": "./schema.json",
  "source": {
    "title": "31 Cool Website Animations Examples And Effects for Inspiration",
    "publisher": "SVGator",
    "url": "https://www.svgator.com/blog/website-animation-examples-and-effects/",
    "analyzed_on": "2026-10-07",
    "effect_count": 31
  },
  "families": {
    "A": "Spatial & Dimensional — depth, 3D, AR/VR, isometric illusion",
    "B": "Narrative & Scroll — story that unfolds as the user moves",
    "C": "Type & Brand Motion — kinetic type and logo identity in motion",
    "D": "Vector Craft — SVG line, draw, morph, icon, character, doodle, collage",
    "E": "Atmosphere & Background — ambient, gradient, liquid, backdrop motion",
    "F": "Interaction & UI — microinteractions, hover, real-time collaboration",
    "G": "State & Feedback — loaders, skeletons, progress",
    "H": "Surface Styles — neumorphism, glassmorphism, claymorphism",
    "I": "Editorial & Media — hero staging, flipbooks, stop-motion"
  },
  "slots": {
    "S0": "Preloader / boot state",
    "S1": "Sticky navigation + header chrome",
    "S2": "Hero (above the fold)",
    "S3": "Scrollytelling chapter",
    "S4": "Effect gallery (showcase grid)",
    "S5": "Product / catalog viewer",
    "S6": "Live collaboration + AR/VR demo bay",
    "S7": "Surface-style playground (neumorphic / glass / clay)",
    "S8": "CTA band + footer",
    "S9": "404 / error page",
    "G": "Global — applies across all sections"
  },
  "effects": [
    {
      "id": "EFFECT-01",
      "n": 1,
      "name": "Real-Time Rendering",
      "family": "A",
      "one_liner": "Hyper-realistic, GPU-accelerated 3D environments the visitor can explore live.",
      "intent": "Add depth, detail and interactivity; let users inspect a product or space from any angle.",
      "trigger": "load + pointer-drag",
      "stack": [
        "WebGL",
        "Three.js",
        "GPU"
      ],
      "slot": "S2",
      "placement": "Full-bleed canvas behind the hero copy; drag to orbit a hero product/object.",
      "params": {
        "duration_ms": "continuous",
        "easing": "damped orbit (lerp 0.08)",
        "fps_target": 60,
        "intensity": "medium"
      },
      "perf": {
        "cost": "high",
        "gpu": true,
        "frame_budget_ms": 8
      },
      "a11y": {
        "prefers_reduced_motion": "swap canvas for a pre-rendered poster image",
        "keyboard": "arrow keys orbit the object",
        "aria": "canvas labelled + text alternative describing the object"
      },
      "acceptance": [
        "Object orbits on drag at 60fps",
        "Scene degrades to static poster under reduced-motion",
        "No layout shift on scene init"
      ],
      "prompt_line": "Build a WebGL/Three.js canvas behind the hero that renders one product object in real time, orbitable by drag (arrow keys for keyboard users), with a pre-rendered poster-image fallback when prefers-reduced-motion is set."
    },
    {
      "id": "EFFECT-02",
      "n": 2,
      "name": "Scrollytelling",
      "family": "B",
      "one_liner": "Scroll position drives a narrative; the story unfolds as the user moves down the page.",
      "intent": "Turn passive scrolling into a guided journey that delivers content in sequence.",
      "trigger": "scroll",
      "stack": [
        "IntersectionObserver",
        "CSS transforms",
        "scroll-timeline"
      ],
      "slot": "S3",
      "placement": "Pinned chapter that advances through 4 beats as scroll progress goes 0→1.",
      "params": {
        "duration_ms": "scroll-linked",
        "easing": "linear progress + eased reveals",
        "fps_target": 60,
        "intensity": "high"
      },
      "perf": {
        "cost": "medium",
        "gpu": true,
        "frame_budget_ms": 6
      },
      "a11y": {
        "prefers_reduced_motion": "unpin; render all beats as a normal stacked article",
        "keyboard": "every beat reachable and readable without scrolling animations",
        "aria": "beats are real headings in order"
      },
      "acceptance": [
        "4 beats advance with scroll",
        "Fully readable as static stacked content with JS off",
        "No scroll-jacking; wheel speed stays native"
      ],
      "prompt_line": "Create a pinned scrollytelling chapter of 4 narrative beats driven by scroll progress, using IntersectionObserver, that flattens into a plain stacked article under prefers-reduced-motion and never hijacks native wheel speed."
    },
    {
      "id": "EFFECT-03",
      "n": 3,
      "name": "AR/VR Motion Graphics",
      "family": "A",
      "one_liner": "Animation placed into augmented or virtual space, reacting to the real environment.",
      "intent": "Guide attention and tell stories inside immersive environments.",
      "trigger": "click (opt-in) + device motion",
      "stack": [
        "WebXR",
        "DeviceOrientation",
        "fallback: 360 video"
      ],
      "slot": "S6",
      "placement": "Demo bay with an 'Enter AR' button; non-AR devices get a draggable 360 preview.",
      "params": {
        "duration_ms": "session",
        "easing": "spatial damping",
        "fps_target": 60,
        "intensity": "high"
      },
      "perf": {
        "cost": "high",
        "gpu": true,
        "frame_budget_ms": 8
      },
      "a11y": {
        "prefers_reduced_motion": "static 360 still",
        "keyboard": "'Enter AR' is a real focusable button",
        "aria": "button announces AR availability and device support"
      },
      "acceptance": [
        "AR start is user-initiated, never autoplay",
        "Unsupported devices get the 360 fallback",
        "Exit control always visible"
      ],
      "prompt_line": "Add a demo bay with an opt-in 'Enter AR' WebXR experience (never autoplaying), a draggable 360 preview fallback for unsupported devices, and a persistent, focusable exit control."
    },
    {
      "id": "EFFECT-04",
      "n": 4,
      "name": "Expressive Typography Animations",
      "family": "C",
      "one_liner": "Bold kinetic type, glitch effects and animated lettering that carry the message.",
      "intent": "Convey brand personality and grab attention in the first second.",
      "trigger": "load + in-view",
      "stack": [
        "CSS keyframes",
        "clip-path",
        "split-text spans"
      ],
      "slot": "S2",
      "placement": "Hero H1 — per-letter stagger reveal, plus a glitch pass on the key word.",
      "params": {
        "duration_ms": [
          700,
          1200
        ],
        "stagger_ms": 40,
        "easing": "cubic-bezier(0.16,1,0.3,1)",
        "fps_target": 60,
        "intensity": "medium"
      },
      "perf": {
        "cost": "low",
        "gpu": true,
        "frame_budget_ms": 4
      },
      "a11y": {
        "prefers_reduced_motion": "letters render final state instantly",
        "keyboard": "n/a",
        "aria": "split letters wrapped in aria-hidden spans with an sr-only full string"
      },
      "acceptance": [
        "Text is selectable and searchable",
        "Screen reader announces one clean sentence, not 40 letters",
        "No FOUT jump on reveal"
      ],
      "prompt_line": "Animate the hero headline with a per-letter stagger reveal and a glitch pass on the emphasised keyword, wrapping split glyphs in aria-hidden spans with one sr-only full-string copy so screen readers read a clean sentence."
    },
    {
      "id": "EFFECT-05",
      "n": 5,
      "name": "Real-Time Collaborative Animations",
      "family": "F",
      "one_liner": "Several users animate and interact with the same elements simultaneously.",
      "intent": "Make digital interaction feel shared, connected and alive.",
      "trigger": "multi-user event",
      "stack": [
        "WebSocket",
        "CRDT/presence",
        "optimistic UI"
      ],
      "slot": "S6",
      "placement": "Live board where visitor cursors and reactions broadcast to all open sessions.",
      "params": {
        "duration_ms": [
          200,
          400
        ],
        "easing": "spring",
        "fps_target": 60,
        "intensity": "medium"
      },
      "perf": {
        "cost": "medium",
        "gpu": false,
        "frame_budget_ms": 6
      },
      "a11y": {
        "prefers_reduced_motion": "presence shown as static avatars, no motion",
        "keyboard": "solo users can still act on the board",
        "aria": "live region announces join/leave politely"
      },
      "acceptance": [
        "Works with a single visitor (no crash, no empty state)",
        "Presence updates under 200ms locally via optimistic UI",
        "Reconnects automatically after network drop"
      ],
      "prompt_line": "Build a presence-driven live board over WebSockets where visitor cursors and reactions broadcast to all open sessions, using optimistic local updates, automatic reconnect, and a graceful single-visitor state."
    },
    {
      "id": "EFFECT-06",
      "n": 6,
      "name": "Ambient Background Motion",
      "family": "E",
      "one_liner": "Subtle gradients, particles and slow flows that add depth without stealing focus.",
      "intent": "Create atmosphere while keeping attention on the content layer.",
      "trigger": "idle-loop",
      "stack": [
        "SVG",
        "CSS animation",
        "canvas particles"
      ],
      "slot": "G",
      "placement": "Site-wide ambient layer behind all sections, capped at low opacity.",
      "params": {
        "duration_ms": "infinite loop 18-30s",
        "easing": "linear / ease-in-out",
        "fps_target": 30,
        "intensity": "low"
      },
      "perf": {
        "cost": "low",
        "gpu": true,
        "frame_budget_ms": 3
      },
      "a11y": {
        "prefers_reduced_motion": "freeze on first frame",
        "keyboard": "n/a",
        "aria": "aria-hidden, decorative only"
      },
      "acceptance": [
        "Ambient layer never exceeds 0.25 opacity behind text",
        "Pauses when tab is hidden",